{
  "$schema": "https://json-schema.org/draft/2020-12/schema",
  "$id": "https://geny.ai/schema/v1/ai-adapter-result.schema.json",
  "title": "AIAdapterResult",
  "description": "docs/05 §2.2 — AI 어댑터가 반환하는 단일 결과 계약. 이미지/알파는 외부 저장소 sha256 로 참조(원문 데이터는 스키마 밖). vendor_metadata 는 벤더별 자유 필드. provenance `parts[].ai_generated` 엔트리 생성에 사용된다.",
  "type": "object",
  "additionalProperties": false,
  "required": [
    "schema_version",
    "task_id",
    "slot_id",
    "image_sha256",
    "vendor",
    "model_version",
    "seed",
    "prompt_sha256",
    "cost_usd",
    "latency_ms",
    "completed_at"
  ],
  "properties": {
    "schema_version": { "type": "string", "const": "v1" },
    "task_id": { "type": "string", "pattern": "^[a-z][a-z0-9._-]{2,62}$" },
    "slot_id": { "$ref": "common/ids.json#/$defs/slotId" },
    "image_sha256": {
      "type": "string",
      "pattern": "^[0-9a-f]{64}$",
      "description": "생성된 RGBA 이미지의 sha256. 실제 바이트는 별도 저장."
    },
    "alpha_sha256": {
      "oneOf": [
        { "type": "string", "pattern": "^[0-9a-f]{64}$" },
        { "type": "null" }
      ],
      "description": "알파 채널이 이미지와 분리 제공되는 경우. null 이면 RGBA 안에 포함."
    },
    "bbox": {
      "type": "array",
      "description": "[x, y, w, h] — 어댑터가 측정한 유효 픽셀 영역. uv_box 검증(docs/05 §3.4)에 사용.",
      "items": { "type": "integer", "minimum": 0 },
      "minItems": 4,
      "maxItems": 4
    },
    "vendor": {
      "type": "string",
      "minLength": 1,
      "maxLength": 64,
      "description": "provenance 의 parts[].vendor 로 그대로 복사 (예: `nano-banana`)."
    },
    "model_version": {
      "type": "string",
      "minLength": 1,
      "maxLength": 64,
      "description": "provenance 의 parts[].model_version 로 그대로 복사."
    },
    "seed": {
      "type": "integer",
      "minimum": 0,
      "maximum": 4294967295,
      "description": "실제 사용한 시드. task.seed 가 null 이었을 경우 어댑터가 도출한 값. provenance 에 그대로 저장."
    },
    "prompt_sha256": {
      "type": "string",
      "pattern": "^[0-9a-f]{64}$",
      "description": "어댑터가 벤더에 최종 전달한 프롬프트의 sha256. PromptBuilder 결과 기준."
    },
    "cost_usd": {
      "type": "number",
      "minimum": 0,
      "maximum": 10
    },
    "latency_ms": {
      "type": "integer",
      "minimum": 0,
      "maximum": 600000
    },
    "completed_at": {
      "type": "string",
      "format": "date-time",
      "description": "벤더 호출 종료 시각 (RFC3339 UTC)."
    },
    "vendor_metadata": {
      "type": "object",
      "description": "벤더별 자유 필드 (nano-banana response id, safety rating 등). 감사 전용, 라우팅에 사용하지 않음.",
      "additionalProperties": true
    },
    "logs": {
      "type": "array",
      "items": { "type": "string", "maxLength": 512 },
      "maxItems": 64,
      "description": "진단용 1줄 로그 (재시도, 폴백 사유)."
    }
  }
}
